[{"roundNumber":1,"startTick":1016,"freezeEndTick":2712,"endTick":8103,"teamASide":"t","teamBSide":"ct","teamAScoreBefore":0,"teamBScoreBefore":0,"teamAEconomy":"pistol","teamBEconomy":"pistol","winnerTeamKey":"teamA","winnerSide":"t","endReason":"t_win"},{"roundNumber":2,"startTick":8423,"freezeEndTick":9703,"endTick":13328,"teamASide":"t","teamBSide":"ct","teamAScoreBefore":1,"teamBScoreBefore":0,"teamAEconomy":"full","teamBEconomy":"eco","winnerTeamKey":"teamA","winnerSide":"t","endReason":"t_win"},{"roundNumber":3,"startTick":13648,"freezeEndTick":14928,"endTick":21285,"teamASide":"t","teamBSide":"ct","teamAScoreBefore":2,"teamBScoreBefore":0,"teamAEconomy":"full","teamBEconomy":"full","winnerTeamKey":"teamA","winnerSide":"t","endReason":"t_win"},{"roundNumber":4,"startTick":21605,"freezeEndTick":25883,"endTick":30129,"teamASide":"t","teamBSide":"ct","teamAScoreBefore":3,"teamBScoreBefore":0,"teamAEconomy":"full","teamBEconomy":"force","winnerTeamKey":"teamA","winnerSide":"t","endReason":"t_win"},{"roundNumber":5,"startTick":30449,"freezeEndTick":31729,"endTick":39516,"teamASide":"t","teamBSide":"ct","teamAScoreBefore":4,"teamBScoreBefore":0,"teamAEconomy":"full","teamBEconomy":"full","winnerTeamKey":"teamB","winnerSide":"ct","endReason":"bomb_defused"},{"roundNumber":6,"startTick":39836,"freezeEndTick":41116,"endTick":46236,"teamASide":"t","teamBSide":"ct","teamAScoreBefore":4,"teamBScoreBefore":1,"teamAEconomy":"semi","teamBEconomy":"full","winnerTeamKey":"teamB","winnerSide":"ct","endReason":"ct_win"},{"roundNumber":7,"startTick":46556,"freezeEndTick":50745,"endTick":56102,"teamASide":"t","teamBSide":"ct","teamAScoreBefore":4,"teamBScoreBefore":2,"teamAEconomy":"semi","teamBEconomy":"full","winnerTeamKey":"teamB","winnerSide":"ct","endReason":"ct_win"},{"roundNumber":8,"startTick":56422,"freezeEndTick":57702,"endTick":64247,"teamASide":"t","teamBSide":"ct","teamAScoreBefore":4,"teamBScoreBefore":3,"teamAEconomy":"full","teamBEconomy":"full","winnerTeamKey":"teamB","winnerSide":"ct","endReason":"bomb_defused"},{"roundNumber":9,"startTick":64567,"freezeEndTick":65847,"endTick":72834,"teamASide":"t","teamBSide":"ct","teamAScoreBefore":4,"teamBScoreBefore":4,"teamAEconomy":"semi","teamBEconomy":"full","winnerTeamKey":"teamB","winnerSide":"ct","endReason":"bomb_defused"},{"roundNumber":10,"startTick":73154,"freezeEndTick":76941,"endTick":78895,"teamASide":"t","teamBSide":"ct","teamAScoreBefore":4,"teamBScoreBefore":5,"teamAEconomy":"full","teamBEconomy":"full","winnerTeamKey":"teamB","winnerSide":"ct","endReason":"ct_win"},{"roundNumber":11,"startTick":79215,"freezeEndTick":80495,"endTick":86867,"teamASide":"t","teamBSide":"ct","teamAScoreBefore":4,"teamBScoreBefore":6,"teamAEconomy":"full","teamBEconomy":"full","winnerTeamKey":"teamA","winnerSide":"t","endReason":"t_win"},{"roundNumber":12,"startTick":87187,"freezeEndTick":88467,"endTick":94204,"teamASide":"t","teamBSide":"ct","teamAScoreBefore":5,"teamBScoreBefore":6,"teamAEconomy":"full","teamBEconomy":"full","winnerTeamKey":"teamA","winnerSide":"t","endReason":"t_win"},{"roundNumber":13,"startTick":97692,"freezeEndTick":99388,"endTick":104294,"teamASide":"ct","teamBSide":"t","teamAScoreBefore":6,"teamBScoreBefore":6,"teamAEconomy":"pistol","teamBEconomy":"pistol","winnerTeamKey":"teamA","winnerSide":"ct","endReason":"ct_win"},{"roundNumber":14,"startTick":104614,"freezeEndTick":105894,"endTick":110046,"teamASide":"ct","teamBSide":"t","teamAScoreBefore":7,"teamBScoreBefore":6,"teamAEconomy":"full","teamBEconomy":"eco","winnerTeamKey":"teamA","winnerSide":"ct","endReason":"ct_win"},{"roundNumber":15,"startTick":110366,"freezeEndTick":111646,"endTick":116461,"teamASide":"ct","teamBSide":"t","teamAScoreBefore":8,"teamBScoreBefore":6,"teamAEconomy":"full","teamBEconomy":"full","winnerTeamKey":"teamB","winnerSide":"t","endReason":"t_win"},{"roundNumber":16,"startTick":116781,"freezeEndTick":118061,"endTick":123504,"teamASide":"ct","teamBSide":"t","teamAScoreBefore":8,"teamBScoreBefore":7,"teamAEconomy":"full","teamBEconomy":"full","winnerTeamKey":"teamA","winnerSide":"ct","endReason":"ct_win"},{"roundNumber":17,"startTick":123824,"freezeEndTick":125104,"endTick":126572,"teamASide":"ct","teamBSide":"t","teamAScoreBefore":9,"teamBScoreBefore":7,"teamAEconomy":"full","teamBEconomy":"force","winnerTeamKey":"teamA","winnerSide":"ct","endReason":"ct_win"},{"roundNumber":18,"startTick":126892,"freezeEndTick":128172,"endTick":131520,"teamASide":"ct","teamBSide":"t","teamAScoreBefore":10,"teamBScoreBefore":7,"teamAEconomy":"full","teamBEconomy":"eco","winnerTeamKey":"teamA","winnerSide":"ct","endReason":"ct_win"},{"roundNumber":19,"startTick":131840,"freezeEndTick":133120,"endTick":139361,"teamASide":"ct","teamBSide":"t","teamAScoreBefore":11,"teamBScoreBefore":7,"teamAEconomy":"full","teamBEconomy":"full","winnerTeamKey":"teamA","winnerSide":"ct","endReason":"bomb_defused"},{"roundNumber":20,"startTick":139681,"freezeEndTick":140961,"endTick":147613,"teamASide":"ct","teamBSide":"t","teamAScoreBefore":12,"teamBScoreBefore":7,"teamAEconomy":"full","teamBEconomy":"full","winnerTeamKey":"teamB","winnerSide":"t","endReason":"target_bombed"},{"roundNumber":21,"startTick":147933,"freezeEndTick":149213,"endTick":153482,"teamASide":"ct","teamBSide":"t","teamAScoreBefore":12,"teamBScoreBefore":8,"teamAEconomy":"full","teamBEconomy":"full","winnerTeamKey":"teamA","winnerSide":"ct","endReason":"ct_win"}]